{"abi_version":1,"capability_ref":"r4_class_capability_v1:17ab6895da12ff6c39e1a5b9","payload_count":253,"payload_path":"artifacts/r4/splits/train.jsonl","payload_ref":"r4_split_payload_v1:16569986daa9102a9117be23","payload_sha256":"bb7b6f031a9ce8756be66c240c1462792fd96cce7a2e638efd59eb66841cdac6","purpose":"training","source_set_ref":"r4_partition_source_v3:089f3682f141d10261cbef2d","split":"train","split_manifest_ref":"r4_split_manifest_v1:b62a9972c710c284ed4c60e3"}
